{
  "contract_version": "1.0.0",
  "data_mode": "demo",
  "currency": "EUR",
  "provider_status": {
    "connected": false,
    "adapter": "curated_demo_hotels",
    "readiness": "contract_ready",
    "bookable": false
  },
  "destination": {
    "id": "budapest",
    "code": "BUD",
    "city": "בודפשט",
    "country": "הונגריה",
    "latitude": 47.4979,
    "longitude": 19.0402
  },
  "areas": [
    {
      "id": "district-v",
      "name": "מרכז העיר והדנובה",
      "short_name": "District V",
      "profile": "הכי נוח לטיול ראשון ולמסלול קצר ברגל",
      "best_for": ["טיול ראשון", "זוגות", "סוף שבוע"],
      "tradeoff": "מיקום מעולה, אבל לרוב יקר ועמוס יותר",
      "transport": "מטרו M1/M2/M3 וחשמליות לאורך הדנובה",
      "route_minutes": 6,
      "average_nightly": 140,
      "position": { "x": 48, "y": 55 }
    },
    {
      "id": "jewish-quarter",
      "name": "הרובע היהודי",
      "short_name": "District VII",
      "profile": "אוכל, ברים וחיי לילה במרחק הליכה",
      "best_for": ["אוכל", "חיי לילה", "תקציב"],
      "tradeoff": "תמורה טובה ואווירה, עם יותר רעש בלילה",
      "transport": "מטרו M1/M2 וטראם 4/6",
      "route_minutes": 10,
      "average_nightly": 108,
      "position": { "x": 60, "y": 43 }
    },
    {
      "id": "buda-castle",
      "name": "בודה ואזור המצודה",
      "short_name": "Buda Castle",
      "profile": "נוף, שקט ואופי היסטורי",
      "best_for": ["זוגות", "שקט", "נוף"],
      "tradeoff": "חוויה רגועה יותר, אך רוב הערבים דורשים נסיעה לפשט",
      "transport": "אוטובוסים 16/116 ופוניקולר",
      "route_minutes": 16,
      "average_nightly": 125,
      "position": { "x": 34, "y": 48 }
    },
    {
      "id": "city-park",
      "name": "פארק העיר והגיבורים",
      "short_name": "City Park",
      "profile": "מרחב, מרחצאות ואפשרויות נוחות למשפחות",
      "best_for": ["משפחות", "מרחב", "שהייה ארוכה"],
      "tradeoff": "יותר חדר באותו תקציב, פחות מרכזי למסלול ערב",
      "transport": "מטרו M1 ואוטובוסים למרכז",
      "route_minutes": 18,
      "average_nightly": 100,
      "position": { "x": 72, "y": 27 }
    }
  ],
  "properties": [
    {
      "id": "danube-house-demo",
      "name": "Danube House Budapest",
      "badge": "הבחירה החכמה",
      "score": 95,
      "area_id": "district-v",
      "stars": 4,
      "guest_score": 9.2,
      "review_count": 1840,
      "image": "city-budapest.webp",
      "room": { "name": "חדר זוגי דלקס", "sleeps": 2, "size_sqm": 24, "beds": "מיטה זוגית גדולה" },
      "location": { "route_minutes": 6, "airport_minutes": 35, "transit": "3 דקות ממטרו Deák Ferenc tér", "latitude": 47.4991, "longitude": 19.0504 },
      "pricing": { "nightly": 128, "base": 512, "taxes": 54, "fees": 12, "total_stay": 578 },
      "policies": { "free_cancellation": true, "pay_at_property": true, "cancellation_deadline": "עד 7 ימים לפני ההגעה", "check_in": "15:00", "check_out": "11:00" },
      "amenities": { "breakfast": true, "family": true, "air_conditioning": true, "elevator": true, "accessible": true },
      "pros": ["מיקום מצוין למסלול ראשון", "כרטיס תחבורה כמעט לא נחוץ ביום הראשון"],
      "cons": ["מחיר לילה גבוה יותר", "אזור תיירותי בשעות העומס"],
      "booking": { "bookable": false, "provider": "demo", "checkout_url": null }
    },
    {
      "id": "quarter-social-demo",
      "name": "Quarter Social Rooms",
      "badge": "התמורה הטובה",
      "score": 89,
      "area_id": "jewish-quarter",
      "stars": 3,
      "guest_score": 8.8,
      "review_count": 2210,
      "image": "hero-budapest-900.webp",
      "room": { "name": "חדר זוגי שקט", "sleeps": 2, "size_sqm": 20, "beds": "מיטה זוגית" },
      "location": { "route_minutes": 10, "airport_minutes": 38, "transit": "4 דקות מטראם 4/6", "latitude": 47.5008, "longitude": 19.0611 },
      "pricing": { "nightly": 96, "base": 384, "taxes": 42, "fees": 10, "total_stay": 436 },
      "policies": { "free_cancellation": true, "pay_at_property": false, "cancellation_deadline": "עד 5 ימים לפני ההגעה", "check_in": "14:00", "check_out": "10:30" },
      "amenities": { "breakfast": false, "family": false, "air_conditioning": true, "elevator": true, "accessible": false },
      "pros": ["חיסכון משמעותי מול המרכז", "מסעדות וחיי לילה ליד המלון"],
      "cons": ["ללא ארוחת בוקר", "רחובות סמוכים פעילים בלילה"],
      "booking": { "bookable": false, "provider": "demo", "checkout_url": null }
    },
    {
      "id": "castle-view-demo",
      "name": "Castle View Residence",
      "badge": "שקט ונוף",
      "score": 84,
      "area_id": "buda-castle",
      "stars": 4,
      "guest_score": 9.0,
      "review_count": 930,
      "image": "city-budapest.webp",
      "room": { "name": "סוויטת סטודיו", "sleeps": 3, "size_sqm": 31, "beds": "מיטה זוגית וספה" },
      "location": { "route_minutes": 16, "airport_minutes": 42, "transit": "2 דקות מאוטובוס 16", "latitude": 47.5014, "longitude": 19.0342 },
      "pricing": { "nightly": 118, "base": 472, "taxes": 48, "fees": 0, "total_stay": 520 },
      "policies": { "free_cancellation": false, "pay_at_property": true, "cancellation_deadline": "ללא החזר לאחר ההזמנה", "check_in": "15:00", "check_out": "11:00" },
      "amenities": { "breakfast": true, "family": true, "air_conditioning": true, "elevator": false, "accessible": false },
      "pros": ["חדר גדול ונוף לבודה", "סביבה רגועה בסוף היום"],
      "cons": ["הזמנה ללא ביטול חינם", "נסיעה נדרשת לרוב מוקדי הערב"],
      "booking": { "bookable": false, "provider": "demo", "checkout_url": null }
    },
    {
      "id": "park-family-demo",
      "name": "Park Family Aparthotel",
      "badge": "הכי מתאים למשפחה",
      "score": 91,
      "area_id": "city-park",
      "stars": 4,
      "guest_score": 8.9,
      "review_count": 1280,
      "image": "hero-budapest-900.webp",
      "room": { "name": "דירת חדר שינה", "sleeps": 4, "size_sqm": 38, "beds": "מיטה זוגית ושתי מיטות יחיד" },
      "location": { "route_minutes": 18, "airport_minutes": 32, "transit": "5 דקות ממטרו M1", "latitude": 47.5142, "longitude": 19.0832 },
      "pricing": { "nightly": 108, "base": 432, "taxes": 45, "fees": 0, "total_stay": 477 },
      "policies": { "free_cancellation": true, "pay_at_property": true, "cancellation_deadline": "עד 3 ימים לפני ההגעה", "check_in": "15:00", "check_out": "11:00" },
      "amenities": { "breakfast": true, "family": true, "air_conditioning": true, "elevator": true, "accessible": true },
      "pros": ["מרחב אמיתי למשפחה", "גישה נוחה לפארק ולמרחצאות"],
      "cons": ["רחוק יותר מארוחות ערב במרכז", "פחות מתאים לחופשת לילה אחת"],
      "booking": { "bookable": false, "provider": "demo", "checkout_url": null }
    }
  ]
}
